<?xml version="1.0" encoding="UTF-8"?>
<xs:schema xmlns:xs="http://www.w3.org/2001/XMLSchema">

  <xs:element name="catalogo">
    <xs:complexType>
      <xs:sequence>
        <xs:element name="producto" maxOccurs="10" minOccurs="1">
          <xs:complexType>
            <xs:sequence>
              <xs:element name="nombre" type="xs:string"/>
              <xs:element name="precio" type="xs:decimal"/>
              <xs:element name="descripcion" type="xs:string"/>
              <xs:element name="categoria" type="xs:string"/>
            </xs:sequence>
            <xs:attribute name="id" use="required">
              <xs:simpleType>
                <xs:restriction base="xs:integer"/>
              </xs:simpleType>
            </xs:attribute>
          </xs:complexType>
        </xs:element>
      </xs:sequence>
    </xs:complexType>
  </xs:element>

</xs:schema>